alumnus_id,full_name,batch_year,department,current_company,current_role,city,skills,bio,mentor_id
1093,Sanya Joshi,2017,Computer Science,NVIDIA,Group Product Manager,Bangalore,"Rust, TensorFlow, Kafka, Kubernetes, AWS, CI/CD",Working at the intersection of machine learning and TensorFlow. Love building things that matter.,
1094,Rohan Rao,2021,Mechanical Engineering,PwC,Control Systems Engineer,Jaipur,"SolidWorks, AutoCAD, 3D Printing, Robotics, Lean Manufacturing",Building scalable data engineering systems. 5+ years of experience in Lean Manufacturing. Open source contributor.,
1095,Urvi Sen,2019,Electrical Engineering,TCS,Frontend Engineer,San Francisco,"Renewable Energy, Power Systems, Smart Grid, TypeScript, SCADA, System Design",Tech lead with expertise in cloud computing. Mentoring 6+ engineers. Advocate for diversity in tech.,
1096,Divya Rao,2017,Biotechnology,Google Research,Senior Research Engineer,Indore,"Drug Discovery, Cell Culture, Machine Learning, Clinical Trials, Immunology",Passionate about blockchain and artificial intelligence. Previously worked on distributed ML pipelines at Flipkart. Loves mentoring junior engineers.,
1097,Rhea Patil,2019,Electronics & Communication,PhonePe,Associate Product Manager,Ahmedabad,"ARM Architecture, PCB Design, Control Systems, Signal Processing",Entrepreneur at heart. Building products in the quantum computing space. Former project lead at a startup.,
1098,Tushar Bhatia,2024,Electronics & Communication,IBM Research,Postdoctoral Fellow,San Francisco,"Signal Processing, MATLAB, VLSI Design, RF Engineering, FPGA",Innovation-focused engineer building next-gen healthtech solutions. Deep expertise in RF Engineering.,
1099,Rahul Bajaj,2018,Biotechnology,ISRO,Senior VLSI Design Engineer,Mumbai,"Microbiology, Machine Learning, Bioinformatics, R, Python, Drug Discovery",Tech lead with expertise in cybersecurity. Mentoring 5+ engineers. Advocate for diversity in tech.,
1100,Bhavna Sethi,2016,Computer Science,Hasura,Senior Software Engineer,Jaipur,"Redis, Rust, SQL, Algorithms, Kafka, REST APIs",Bridging the gap between edge computing and machine learning. Published research in top-tier conferences.,
1101,Riya Menon,2021,Mechanical Engineering,Flipkart,Founder & CEO,Chennai,"Lean Manufacturing, Six Sigma, CNC Programming, CATIA, Supply Chain, Manufacturing",Expert in computer vision with deep experience in Supply Chain. Contributed to products used by millions of users.,
1102,Arjun Bhatia,2018,Electronics & Communication,Chargebee,SDE-II,Pune,"TensorFlow, ARM Architecture, Data Structures, Embedded Systems, MATLAB, Antenna Design",Tech lead with expertise in machine learning. Mentoring 6+ engineers. Advocate for diversity in tech.,
1103,Atharv Mishra,2018,Information Technology,Yellow.ai,Principal Engineer,Jaipur,"JavaScript, Mobile Development, Rust, Cloud Computing, TypeScript, DevOps, Flutter",Bridging the gap between edtech and deep learning. Published research in top-tier conferences.,
1104,Tanvi Agarwal,2021,Mechanical Engineering,Meesho,Co-Founder,Chennai,"Supply Chain, SolidWorks, Thermodynamics, CFD",Bridging the gap between edtech and computer vision. Published research in top-tier conferences.,Dr. Raghavan
1105,Rajesh Reddy,2023,Electrical Engineering,Shopify,SDE-II,Kolkata,"Control Systems, Embedded Systems, Kafka, CI/CD, PLC Programming",Specializing in autonomous systems applications. Strong foundation in natural language processing. Passionate about teaching and outreach.,
1106,Suresh Desai,2016,Biotechnology,Amazon,Senior Researcher,Bangalore,"Drug Discovery, Biostatistics, Cell Culture, CRISPR, Python, R, Protein Engineering",Driven by curiosity in blockchain. Led multiple artificial intelligence projects. Believes in continuous learning and growth.,
1107,Tushar Mishra,2018,Civil Engineering,Spotify,Principal Engineer,Seattle,"BIM, Concrete Technology, Quantity Estimation, Redis, AutoCAD, System Design",Bridging the gap between cybersecurity and Quantity Estimation. Published research in top-tier conferences.,
1108,Anika Mahajan,2020,Information Technology,KPMG,Senior Business Analyst,Toronto,"Cloud Computing, Node.js, Mobile Development, Scrum, Tableau",Passionate about healthtech and Cloud Computing. Previously worked on real-time recommendation engines at Microsoft. Loves mentoring junior engineers.,
1109,Ramesh Kumar,2017,Computer Science,Ola,Software Engineer,Chandigarh,"REST APIs, Redis, Data Structures, Natural Language Processing, TypeScript, CI/CD, Algorithms",Passionate about healthtech and TypeScript. Previously worked on health monitoring platforms at Infosys. Loves mentoring junior engineers.,
1110,Harish Joshi,2016,Mechanical Engineering,Byju's,VP Engineering,Toronto,"Manufacturing, Robotics, Project Management, ANSYS, CATIA, GraphQL, CFD",Driven by curiosity in autonomous systems. Led multiple Robotics projects. Believes in continuous learning and growth. Transitioned from core engineering to engineering management.,
1111,Vikram Rajan,2015,Mechanical Engineering,DeepMind,Quality Engineer,Gurgaon,"CNC Programming, SolidWorks, CATIA",sustainability enthusiast with a knack for computer vision. Transitioned from data analyst to pursue passion in technology.,
1112,Ankit Patel,2018,Mechanical Engineering,ShareChat,Founder & CEO,Chennai,"Manufacturing, Six Sigma, Python, Thermodynamics",Expert in mobile applications with deep experience in Python. Contributed to products used by millions of users.,Dr. Desai
1113,Meera Pandey,2024,Chemical Engineering,Groww,Product Manager,Kochi,"R&D, Python, Data Analysis, Process Simulation, Environmental Engineering",Full stack mobile applications professional. Experienced in machine learning and cloud technologies. Hackathon winner.,
1114,Swati Arora,2016,Electronics & Communication,ShareChat,Associate Product Manager,Kolkata,"Signal Processing, PCB Design, SQL, Microservices, VLSI Design",Tech lead with expertise in blockchain. Mentoring 3+ engineers. Advocate for diversity in tech. Transitioned from core engineering to product management.,
1115,Vivek Joshi,2015,Electronics & Communication,Slack,Environmental Engineer,Ahmedabad,"Wireless Communication, RF Engineering, Verilog",Tech lead with expertise in deep learning. Mentoring 6+ engineers. Advocate for diversity in tech.,Dr. Banerjee
1116,Trisha Nair,2016,Mechanical Engineering,Accenture,Business Analyst,Kolkata,"Manufacturing, Quality Control, Robotics, Supply Chain, CATIA",Entrepreneur at heart. Building products in the natural language processing space. Former intern at Google.,
1117,Aishwarya Bose,2020,Chemical Engineering,Oracle,VP Engineering,Coimbatore,"Python, Environmental Engineering, Chemical Kinetics, MATLAB",Expert in cybersecurity with deep experience in natural language processing. Contributed to products used by millions of users.,Dr. Krishnamurthy
1118,Diya Desai,2024,Mechanical Engineering,Atlassian,Product Manager,New York,"CFD, Supply Chain, Six Sigma, 3D Printing, Project Management, SolidWorks",Data-driven professional focused on IoT. Background in deep learning. Marathon runner and tech blogger.,
1119,Amit Kumar,2022,Biotechnology,Atlan,Analytics Engineer,Jaipur,"Deep Learning, R, Protein Engineering, Biochemistry, Machine Learning, Genomics, Kafka",autonomous systems enthusiast with a knack for artificial intelligence. Transitioned from software engineer to pursue passion in technology.,
1120,Kunal Chandra,2020,Chemical Engineering,Zerodha,Director of Engineering,Seattle,"Environmental Engineering, Catalysis, Pharmaceutical Engineering, Process Simulation, Microservices, Data Analysis, MongoDB",Tech lead with expertise in autonomous systems. Mentoring 7+ engineers. Advocate for diversity in tech. Transitioned from core engineering to engineering management.,
1121,Gaurav Chatterjee,2016,Electronics & Communication,Meesho,VP Engineering,Coimbatore,"Control Systems, Robotics, IoT, ARM Architecture",Building scalable edge computing systems. 4+ years of experience in natural language processing. Open source contributor.,
1122,Aishwarya Mahajan,2016,Mechanical Engineering,Zomato,Senior CEO,Delhi NCR,"Supply Chain, Manufacturing, Six Sigma, CFD, Python, ANSYS",Focused on solving real-world problems using AR/VR. Background in machine learning. Active tech community speaker.,
1123,Tara Chopra,2018,Information Technology,BCG,Senior Strategy Consultant,Chennai,"Networking, Cybersecurity, AWS, Agile",Building scalable blockchain systems. 6+ years of experience in natural language processing. Open source contributor.,
1124,Bhavna Sen,2024,Mechanical Engineering,Meesho,Director of Product,Noida,"3D Printing, Python, SolidWorks",cybersecurity enthusiast with a knack for Python. Transitioned from researcher to pursue passion in technology.,
1125,Parth Banerjee,2021,Mechanical Engineering,Bain & Company,Strategy Consultant,Kochi,"Robotics, 3D Printing, ANSYS, FEA, Manufacturing, CNC Programming",Passionate about frontend development and Robotics. Previously worked on autonomous drones at Amazon. Loves mentoring junior engineers.,
1126,Ishaan Chatterjee,2022,Chemical Engineering,Freshworks,Co-Founder,Delhi NCR,"Process Design, R&D, Data Analysis, Process Simulation, Quality Control, Six Sigma, Polymer Science",edtech enthusiast with a knack for Quality Control. Transitioned from project lead to pursue passion in technology.,
1127,Tarun Bhatt,2023,Civil Engineering,Amazon,Tech Lead Manager,Indore,"STAAD Pro, Environmental Engineering, Geotechnical Engineering, Structural Analysis, Concrete Technology, AutoCAD",Entrepreneur at heart. Building products in the blockchain space. Former project lead at Microsoft.,
1128,Arya Subramaniam,2020,Chemical Engineering,Swiggy,Process Engineer,Gurgaon,"Thermodynamics, Quality Control, Catalysis, Six Sigma, Chemical Kinetics",Expert in cybersecurity with deep experience in Chemical Kinetics. Contributed to products used by millions of users.,Dr. Desai
1129,Tarun Mahajan,2017,Mechanical Engineering,CRED,Tech Lead Manager,Kochi,"Manufacturing, Rust, 3D Printing, CFD, Machine Learning, Lean Manufacturing, Thermodynamics",Tech lead with expertise in deep learning. Mentoring 6+ engineers. Advocate for diversity in tech. Transitioned from core engineering to engineering management.,
1130,Priya Bhatt,2016,Biotechnology,Byju's,Engineering Manager,Toronto,"Biostatistics, Molecular Biology, CRISPR, Microbiology, Python, Cell Culture, Protein Engineering",Data-driven professional focused on cybersecurity. Background in artificial intelligence. Marathon runner and tech blogger.,
1131,Atharv Chandra,2015,Computer Science,Zoho,Senior Software Engineer,Amsterdam,"TensorFlow, GraphQL, React, Microservices, Python, REST APIs",Innovation-focused engineer building next-gen AR/VR solutions. Deep expertise in Python.,Dr. Subramaniam
1132,Advait Iyer,2015,Chemical Engineering,Notion,Senior Engineering Manager,Chandigarh,"Pharmaceutical Engineering, ASPEN Plus, Process Design",fintech enthusiast with a knack for ASPEN Plus. Transitioned from mechanical engineer to pursue passion in technology.,
1133,Saanvi Pandey,2016,Chemical Engineering,Apple,Senior Engineering Manager,New York,"ASPEN Plus, Environmental Engineering, Data Analysis",Innovation-focused engineer building next-gen cybersecurity solutions. Deep expertise in Data Analysis.,
1134,Nandini Iyer,2022,Civil Engineering,Own Startup,Co-Founder,Jaipur,"Geotechnical Engineering, Construction Management, Structural Analysis, STAAD Pro, Environmental Engineering, Revit, Water Resources",Specializing in mobile applications applications. Strong foundation in artificial intelligence. Passionate about teaching and outreach.,Dr. Raghavan
1135,Jiya Venkatesh,2024,Information Technology,McKinsey,Technology Consultant,Chennai,"UI/UX Design, Data Analytics, AWS, SQL",Driven by curiosity in AR/VR. Led multiple UI/UX Design projects. Believes in continuous learning and growth.,Dr. Chakraborty
1136,Siddharth Deshpande,2015,Civil Engineering,Ola,CEO,London,"STAAD Pro, GIS, Quantity Estimation, Docker, TensorFlow, Water Resources, AutoCAD",Passionate about machine learning and healthtech. Previously worked on autonomous drones at a startup. Loves mentoring junior engineers. Transitioned from software engineering to entrepreneurship.,
1137,Zara Menon,2024,Mechanical Engineering,Netflix,Software Developer,London,"Robotics, CNC Programming, Git, Six Sigma, Kafka, Python",Working at the intersection of autonomous systems and CNC Programming. Love building things that matter.,Dr. Desai
1138,Kiara Venkatesh,2015,Information Technology,IBM,Engineering Manager,Seattle,"Cloud Computing, Scrum, Networking",Full stack healthtech professional. Experienced in machine learning and cloud technologies. Hackathon winner.,
1139,Ananya Pandey,2021,Information Technology,Spotify,Product Analyst,Chennai,"Agile, UI/UX Design, Networking, JavaScript, Scrum, Cloud Computing",Expert in robotics with deep experience in Scrum. Contributed to products used by millions of users.,
1140,Priya Bhatia,2015,Biotechnology,DeepMind,Senior Researcher,Amsterdam,"Immunology, Molecular Biology, Protein Engineering",IoT enthusiast with a knack for deep learning. Transitioned from teaching assistant to pursue passion in technology.,
1141,Harish Malhotra,2023,Computer Science,Unacademy,CTO & Co-Founder,Delhi NCR,"TensorFlow, Data Structures, SQL, Microservices, Python",Driven by curiosity in sustainability. Led multiple Python projects. Believes in continuous learning and growth. Transitioned from data science to entrepreneurship.,
1142,Jay Bhatt,2018,Electrical Engineering,Flipkart,Co-Founder,Chennai,"Renewable Energy, Power Systems, Smart Grid, IoT, Embedded Systems, Kafka, Python",Working at the intersection of mobile applications and Embedded Systems. Love building things that matter. Transitioned from software engineering to entrepreneurship.,
1143,Pranav Arora,2019,Electronics & Communication,Yellow.ai,Full Stack Developer,Kolkata,"Control Systems, FPGA, Signal Processing, Verilog, MATLAB, Machine Learning, System Design",Specializing in machine learning applications. Strong foundation in autonomous systems. Passionate about teaching and outreach.,
1144,Kunal Sethi,2020,Civil Engineering,BCG,Senior Consultant,Kolkata,"STAAD Pro, Revit, Water Resources, GIS, Construction Management, Geotechnical Engineering, Surveying",Bridging the gap between natural language processing and frontend development. Published research in top-tier conferences.,
1145,Aditya Iyer,2019,Computer Science,Groww,Senior Staff Engineer,Bangalore,"Java, Docker, TypeScript, Git, MongoDB, Kubernetes, Computer Vision",Focused on solving real-world problems using artificial intelligence. Background in machine learning. Active tech community speaker.,Dr. Venkatesh
1146,Sakshi Mehta,2015,Computer Science,Bain & Company,Senior Consultant,Tokyo,"SQL, TypeScript, Rust, Git, Machine Learning, System Design",Specializing in blockchain applications. Strong foundation in TypeScript. Passionate about teaching and outreach.,
1147,Aishwarya Mehta,2015,Biotechnology,Ernst & Young,Senior Business Analyst,Indore,"PCR, Molecular Biology, Protein Engineering, Biochemistry, Cell Culture, Microservices, Clinical Trials",Focused on solving real-world problems using machine learning. Background in computer vision. Active tech community speaker. Transitioned from core engineering to consulting.,
1148,Abhinav Singh,2016,Information Technology,Slack,Director of Engineering,Bangalore,"Mobile Development, Data Analytics, SQL, Computer Vision, Networking, Flutter, System Design",Expert in mobile applications with deep experience in Networking. Contributed to products used by millions of users. Transitioned from data science to engineering management.,Dr. Banerjee
1149,Sanya Deshpande,2020,Electrical Engineering,Zomato,Director of Engineering,Tokyo,"Linux, CI/CD, Power Electronics, PLC Programming, Python",Bridging the gap between frontend development and Power Electronics. Published research in top-tier conferences. Transitioned from software engineering to engineering management.,
1150,Saanvi Tiwari,2024,Mechanical Engineering,Flipkart,CTO,Chennai,"FEA, Quality Control, AutoCAD, SolidWorks, Supply Chain",quantum computing enthusiast with a knack for SolidWorks. Transitioned from project lead to pursue passion in technology.,
1151,Nikhil Pandey,2017,Civil Engineering,Salesforce,Technical Product Manager,Kolkata,"Environmental Engineering, Surveying, Geotechnical Engineering, MongoDB, System Design",Building scalable data engineering systems. 4+ years of experience in System Design. Open source contributor. Transitioned from core engineering to product management.,
1152,Advait Mishra,2017,Civil Engineering,Flipkart,Senior Hardware Engineer,Coimbatore,"Revit, Water Resources, Environmental Engineering, AutoCAD, Quantity Estimation",Bridging the gap between sustainability and Revit. Published research in top-tier conferences.,Prof. Malhotra
1153,Aishwarya Kaul,2016,Electrical Engineering,NVIDIA,Data Analyst,Toronto,"Renewable Energy, Power Systems, CI/CD, Control Systems, Docker, Power Electronics, SCADA",Building scalable artificial intelligence systems. 5+ years of experience in Renewable Energy. Open source contributor.,
1154,Amit Tiwari,2023,Chemical Engineering,Airbnb,Quality Engineer,London,"Chemical Kinetics, Python, ASPEN Plus, Process Design",Driven by curiosity in artificial intelligence. Led multiple machine learning projects. Believes in continuous learning and growth.,Dr. Krishnamurthy
1155,Meera Pillai,2016,Civil Engineering,Hasura,Tech Lead Manager,Hyderabad,"Geotechnical Engineering, Revit, Quantity Estimation, Project Management, GIS, AutoCAD",Building scalable data engineering systems. 3+ years of experience in Project Management. Open source contributor.,Dr. Mehta
1156,Divya Singh,2021,Biotechnology,Freshworks,Senior Software Engineer,Pune,"Bioinformatics, PCR, Molecular Biology, Microbiology, Natural Language Processing, Biochemistry, Cell Culture",Data-driven professional focused on natural language processing. Background in Natural Language Processing. Marathon runner and tech blogger. Transitioned from core engineering to software engineering.,
1157,Nandini Menon,2021,Mechanical Engineering,Ola,Staff Engineer,Indore,"Manufacturing, Docker, Supply Chain, PyTorch, Thermodynamics",Data-driven professional focused on blockchain. Background in computer vision. Marathon runner and tech blogger.,
1158,Vivek Chandra,2024,Electrical Engineering,McKinsey,Business Analyst,Tokyo,"Circuit Design, Electrical Machines, IoT, Transformers, Python, PLC Programming, Smart Grid",Driven by curiosity in deep learning. Led multiple machine learning projects. Believes in continuous learning and growth.,
1159,Atharv Srinivasan,2017,Electronics & Communication,Zomato,Co-Founder,Berlin,"PCB Design, Embedded Systems, Verilog, Robotics",Working at the intersection of IoT and Robotics. Love building things that matter.,
1160,Siddharth Reddy,2021,Chemical Engineering,Zomato,Applied Scientist,Coimbatore,"R&D, System Design, Pharmaceutical Engineering, Catalysis, Computer Vision",Tech lead with expertise in IoT. Mentoring 5+ engineers. Advocate for diversity in tech.,
1161,Karthik Joshi,2024,Electronics & Communication,Tower Research Capital,Biotech Researcher,Jaipur,"Antenna Design, Robotics, Wireless Communication, Sensor Networks, ARM Architecture",Passionate about robotics and ARM Architecture. Previously worked on real-time recommendation engines at Amazon. Loves mentoring junior engineers.,
1162,Vihaan Bhatia,2015,Biotechnology,Google Research,Research Engineer,Chennai,"R, Immunology, Python, Clinical Trials, Drug Discovery",Building scalable distributed systems systems. 4+ years of experience in Python. Open source contributor.,
1163,Aditya Desai,2022,Electrical Engineering,Barclays,Biotech Researcher,Tokyo,"Electrical Machines, Power Electronics, MATLAB",Building scalable cybersecurity systems. 3+ years of experience in natural language processing. Open source contributor.,Dr. Nair
1164,Akash Gupta,2022,Computer Science,Zomato,Senior ML Engineer,Tokyo,"Deep Learning, Rust, TypeScript, SQL, MongoDB, PyTorch, Computer Vision",Entrepreneur at heart. Building products in the quantum computing space. Former QA engineer at Razorpay.,
1165,Varun Kaul,2016,Information Technology,NVIDIA,SDE-II,London,"AWS, Tableau, DevOps, Power BI, Computer Vision, REST APIs",Passionate about autonomous systems and AWS. Previously worked on educational technology tools at Amazon. Loves mentoring junior engineers.,
1166,Jiya Agarwal,2019,Chemical Engineering,IBM Research,Senior Research Engineer,Chennai,"Data Analysis, Catalysis, MATLAB, Six Sigma, ASPEN Plus, Process Design, Thermodynamics",Working at the intersection of frontend development and natural language processing. Love building things that matter.,
1167,Deepak Verma,2020,Information Technology,Slack,Senior Software Developer,Pune,"AWS, JavaScript, Data Analytics, TypeScript, Power BI, SQL",Focused on solving real-world problems using artificial intelligence. Background in deep learning. Active tech community speaker.,
1168,Tara Krishnan,2018,Civil Engineering,Yellow.ai,CEO,Bangalore,"BIM, Concrete Technology, Revit, Geotechnical Engineering, Water Resources",Focused on solving real-world problems using cybersecurity. Background in Concrete Technology. Active tech community speaker.,
1169,Rhea Pandey,2016,Electrical Engineering,Meesho,AI Engineer,Gurgaon,"Automation, Java, Control Systems, Natural Language Processing, Transformers, SCADA, Python",Data-driven professional focused on AR/VR. Background in computer vision. Marathon runner and tech blogger.,
1170,Atharv Banerjee,2023,Information Technology,Oracle,Senior Engineering Manager,Gurgaon,"Rust, Cloud Computing, Cybersecurity, React, Tableau, Node.js, Scrum",Expert in AR/VR with deep experience in Rust. Contributed to products used by millions of users. Transitioned from data science to engineering management.,
1171,Myra Iyer,2022,Electronics & Communication,Twilio,Full Stack Developer,Kochi,"Robotics, FPGA, Redis, MATLAB, Antenna Design, Sensor Networks, SQL",Passionate about data engineering and natural language processing. Previously worked on computer vision systems at Google. Loves mentoring junior engineers.,Dr. Subramaniam
1172,Divya Banerjee,2023,Information Technology,Meesho,Associate Product Manager,Coimbatore,"UI/UX Design, Data Analytics, Cybersecurity, NoSQL, Power BI, SQL, Kafka",robotics enthusiast with a knack for machine learning. Transitioned from mechanical engineer to pursue passion in technology. Transitioned from software engineering to product management.,Dr. Sharma
1173,Devesh Mehta,2020,Computer Science,Swiggy,Applied Scientist,Kolkata,"Deep Learning, Rust, TypeScript, Git, Python",Passionate about natural language processing and machine learning. Previously worked on health monitoring platforms at Wipro. Loves mentoring junior engineers.,Dr. Reddy
1174,Rhea Rajan,2015,Information Technology,GitHub,Senior Applied Scientist,Kolkata,"Deep Learning, UI/UX Design, Data Analytics, NoSQL, Kubernetes, Angular",Building scalable natural language processing systems. 3+ years of experience in deep learning. Open source contributor.,
1175,Vishal Arora,2021,Information Technology,PhonePe,Technical Co-Founder,Bangalore,"Azure, React, Git, Power BI, Angular, System Design, Python",Working at the intersection of fintech and Git. Love building things that matter. Transitioned from software engineering to entrepreneurship.,
1176,Shreyas Saxena,2019,Biotechnology,Amazon,Technical Product Manager,Toronto,"Linux, Bioinformatics, Immunology, Molecular Biology, Clinical Trials, React, Genomics",Working at the intersection of AR/VR and Immunology. Love building things that matter. Transitioned from core engineering to product management.,Dr. Raghavan
1177,Aishwarya Rao,2016,Chemical Engineering,Accenture,Business Analyst,Bangalore,"Polymer Science, R&D, Chemical Kinetics, ASPEN Plus, Data Analysis, Process Design",Data-driven professional focused on robotics. Background in R&D. Marathon runner and tech blogger.,
1178,Harini Bhatt,2020,Computer Science,Oracle,CTO,Noida,"Microservices, Java, Machine Learning, Docker, Rust, AWS",Passionate about autonomous systems and natural language processing. Previously worked on IoT sensor networks at a research lab. Loves mentoring junior engineers.,
1179,Shaurya Joshi,2021,Electrical Engineering,Accenture,Mechanical Design Engineer,Dublin,"Automation, Python, Power Systems, Power Electronics, IoT, MATLAB, Electrical Machines",Data-driven professional focused on fintech. Background in deep learning. Marathon runner and tech blogger.,
1180,Rashmi Singh,2023,Electrical Engineering,Ernst & Young,Senior Consultant,Delhi NCR,"Transformers, Power Electronics, Python, Automation, Control Systems, Smart Grid",Entrepreneur at heart. Building products in the data engineering space. Former data analyst at Google.,
1181,Aarav Reddy,2024,Information Technology,Atlassian,Senior Product Manager,Jaipur,"Cybersecurity, Networking, JavaScript, Azure, Agile, Power BI",Full stack quantum computing professional. Experienced in computer vision and cloud technologies. Hackathon winner.,Dr. Kulkarni
1182,Bhavna Rajan,2019,Civil Engineering,NVIDIA,Group Product Manager,Berlin,"Concrete Technology, Quantity Estimation, Structural Analysis",natural language processing enthusiast with a knack for cloud computing. Transitioned from teaching assistant to pursue passion in technology.,
1183,Mira Bajaj,2024,Electronics & Communication,BrowserStack,Founder,Chandigarh,"Control Systems, PCB Design, ARM Architecture, VLSI Design, FPGA, C++, RF Engineering",Full stack IoT professional. Experienced in computer vision and cloud technologies. Hackathon winner.,Dr. Reddy
