alumnus_id,full_name,batch_year,department,current_company,current_role,city,skills,bio,mentor_id
1184,Pari Venkatesh,2024,Civil Engineering,Ernst & Young,Business Analyst,Kolkata,"Concrete Technology, Project Management, Surveying, Water Resources",Entrepreneur at heart. Building products in the computer vision space. Former QA engineer at a research lab.,
1185,Ankit Arora,2023,Electrical Engineering,Infosys,Software Developer,Indore,"Automation, Smart Grid, IoT, Embedded Systems, MATLAB, Computer Vision, Node.js",Full stack AR/VR professional. Experienced in artificial intelligence and cloud technologies. Hackathon winner.,
1186,Reyansh Arora,2021,Information Technology,Yellow.ai,Senior Data Scientist,Hyderabad,"AWS, JavaScript, Cloud Computing, TypeScript, Tableau, DevOps, Kubernetes",Driven by curiosity in computer vision. Led multiple AWS projects. Believes in continuous learning and growth.,Dr. Venkatesh
1187,Rhea Kaul,2023,Electrical Engineering,ShareChat,Co-Founder,Mumbai,"Smart Grid, IoT, Power Systems, Circuit Design, Automation",Bridging the gap between autonomous systems and artificial intelligence. Published research in top-tier conferences.,Dr. Venkatesh
1188,Om Arora,2020,Electrical Engineering,PhonePe,CTO & Co-Founder,Indore,"IoT, Control Systems, MATLAB, Power Electronics",Career focused on healthtech. Transitioned to Control Systems after discovering passion during a side project.,
1189,Gauri Kapoor,2015,Civil Engineering,Bain & Company,Senior Management Consultant,Delhi NCR,"AutoCAD, Python, Geotechnical Engineering, Quantity Estimation, GIS, Concrete Technology, Construction Management",Tech lead with expertise in sustainability. Mentoring 4+ engineers. Advocate for diversity in tech.,Dr. Gupta
1190,Dhruv Iyer,2021,Chemical Engineering,Zomato,Quality Engineer,Gurgaon,"Environmental Engineering, Quality Control, Process Simulation, Catalysis, Thermodynamics",Entrepreneur at heart. Building products in the edtech space. Former project lead at TCS.,
1191,Shaurya Bhatia,2015,Civil Engineering,Salesforce,Senior Full Stack Developer,Hyderabad,"BIM, Java, Environmental Engineering, GIS, Quantity Estimation, Construction Management, Surveying",Innovation-focused engineer building next-gen AR/VR solutions. Deep expertise in GIS.,Prof. Kapoor
1192,Om Kumar,2018,Electrical Engineering,Adobe,Senior Product Manager,Coimbatore,"IoT, Embedded Systems, Control Systems, Smart Grid, Automation, MATLAB",Passionate about edge computing and artificial intelligence. Previously worked on real-time recommendation engines at Microsoft. Loves mentoring junior engineers.,Dr. Banerjee
1193,Parth Malhotra,2019,Chemical Engineering,IISc Research,Senior PhD Researcher,Ahmedabad,"Thermodynamics, Process Design, Polymer Science",Career focused on quantum computing. Transitioned to Process Design after discovering passion during a side project.,
1194,Gaurav Bajaj,2019,Electronics & Communication,OpenAI,Senior Hardware Engineer,Chandigarh,"Robotics, IoT, FPGA",computer vision enthusiast with a knack for natural language processing. Transitioned from consultant to pursue passion in technology.,Dr. Subramaniam
1195,Aarav Pillai,2023,Mechanical Engineering,BCG,Associate,Indore,"Node.js, Supply Chain, React, CFD, Lean Manufacturing, Thermodynamics, Python",Focused on solving real-world problems using distributed systems. Background in computer vision. Active tech community speaker. Transitioned from core engineering to consulting.,Prof. Malhotra
1196,Tushar Pillai,2022,Electronics & Communication,Byju's,Embedded Systems Engineer,Chandigarh,"Robotics, Python, IoT, Signal Processing, Control Systems, Antenna Design, MATLAB",Building scalable cybersecurity systems. 2+ years of experience in computer vision. Open source contributor.,
1197,Sahil Sethi,2024,Mechanical Engineering,Spotify,VP Engineering,Berlin,"Lean Manufacturing, FEA, AutoCAD, Quality Control, CATIA",Tech lead with expertise in distributed systems. Mentoring 4+ engineers. Advocate for diversity in tech.,
1198,Vishal Bhatt,2019,Biotechnology,Zomato,Technical Product Manager,Tokyo,"Redis, Cell Culture, Machine Learning, Clinical Trials, Drug Discovery, CRISPR",Building scalable artificial intelligence systems. 7+ years of experience in natural language processing. Open source contributor. Transitioned from data science to product management.,Dr. Patel
1199,Arnav Menon,2022,Mechanical Engineering,Uber,Engineering Lead,Amsterdam,"SolidWorks, Supply Chain, Quality Control, 3D Printing, SQL, MongoDB, Thermodynamics",Full stack artificial intelligence professional. Experienced in 3D Printing and cloud technologies. Hackathon winner.,Dr. Gupta
1200,Diya Khanna,2017,Biotechnology,Meesho,Founder & CEO,Hyderabad,"Bioinformatics, CI/CD, Molecular Biology, SQL, Python, Drug Discovery, R",Bridging the gap between fintech and deep learning. Published research in top-tier conferences. Transitioned from research to entrepreneurship.,
1201,Tarun Kaul,2019,Mechanical Engineering,Ola,SDE-II,Dublin,"CNC Programming, CFD, PyTorch, Thermodynamics, Computer Vision",Bridging the gap between frontend development and artificial intelligence. Published research in top-tier conferences.,
1202,Aditi Kumar,2023,Information Technology,Ola,Director of Engineering,San Francisco,"AWS, Azure, NoSQL, Power BI, CI/CD",Career focused on natural language processing. Transitioned to deep learning after discovering passion during a side project. Transitioned from software engineering to engineering management.,
1203,Vivek Patel,2018,Computer Science,NVIDIA,Staff Engineer,Amsterdam,"Java, Docker, Go, MongoDB, Computer Vision, Node.js",Specializing in AR/VR applications. Strong foundation in Java. Passionate about teaching and outreach.,
1204,Abhinav Iyer,2018,Chemical Engineering,Stripe,Tech Lead Manager,Mumbai,"Environmental Engineering, Chemical Kinetics, Pharmaceutical Engineering, Go, Polymer Science, System Design, Python",Building scalable distributed systems systems. 5+ years of experience in machine learning. Open source contributor. Transitioned from data science to engineering management.,Prof. Singh
1205,Pranav Venkatesh,2016,Mechanical Engineering,McKinsey,Strategy Consultant,Noida,"Quality Control, 3D Printing, Supply Chain",Specializing in edtech applications. Strong foundation in Quality Control. Passionate about teaching and outreach.,
1206,Vidya Das,2018,Biotechnology,Uber,Technical Product Manager,Seattle,"Molecular Biology, CRISPR, PCR, Cell Culture, Python, Biochemistry, Genomics",Driven by curiosity in quantum computing. Led multiple natural language processing projects. Believes in continuous learning and growth.,
1207,Parth Deshpande,2016,Computer Science,Notion,Senior ML Engineer,Jaipur,"Deep Learning, Linux, Docker, Rust, React, System Design, REST APIs",Full stack IoT professional. Experienced in computer vision and cloud technologies. Hackathon winner.,
1208,Anika Hegde,2017,Civil Engineering,Swiggy,VP Engineering,Gurgaon,"Python, Environmental Engineering, Project Management, GIS, Revit",Data-driven professional focused on autonomous systems. Background in Environmental Engineering. Marathon runner and tech blogger.,Prof. Singh
1209,Aishwarya Pillai,2024,Computer Science,ShareChat,SDE-III,Bangalore,"Natural Language Processing, React, Git, Go, REST APIs",Building scalable deep learning systems. 3+ years of experience in REST APIs. Open source contributor.,Dr. Krishnamurthy
1210,Kunal Srinivasan,2023,Information Technology,Razorpay,Co-Founder,Kochi,"Agile, Python, AWS, UI/UX Design, Docker, Data Analytics",Passionate about quantum computing and natural language processing. Previously worked on real-time recommendation engines at Flipkart. Loves mentoring junior engineers.,
1211,Devesh Reddy,2019,Chemical Engineering,IISc Research,Senior Postdoctoral Fellow,Bangalore,"Six Sigma, ASPEN Plus, Thermodynamics",Driven by curiosity in edtech. Led multiple deep learning projects. Believes in continuous learning and growth.,
1212,Kunal Krishnan,2015,Information Technology,Adobe,Senior SDE,Singapore,"UI/UX Design, Mobile Development, Docker, GraphQL, DevOps, Angular, Flutter",Entrepreneur at heart. Building products in the mobile applications space. Former teaching assistant at Flipkart.,
1213,Arjun Hegde,2016,Information Technology,Zerodha,SDE-III,Berlin,"UI/UX Design, Mobile Development, GraphQL, NoSQL, Git, Networking, Python",Driven by curiosity in distributed systems. Led multiple Git projects. Believes in continuous learning and growth.,
1214,Simran Tiwari,2018,Information Technology,Shopify,Principal Engineer,Hyderabad,"AWS, Azure, Data Analytics, React, DevOps, SQL",Tech lead with expertise in natural language processing. Mentoring 2+ engineers. Advocate for diversity in tech.,
1215,Rajesh Srinivasan,2020,Biotechnology,DeepSource,Lead Data Scientist,London,"Bioinformatics, PCR, CI/CD, Molecular Biology, R, Computer Vision, Machine Learning",Bridging the gap between fintech and natural language processing. Published research in top-tier conferences.,
1216,Shreyas Mehta,2023,Biotechnology,Google Research,Lab Director,Indore,"Molecular Biology, Protein Engineering, Microbiology, Machine Learning, Cell Culture, PCR",Full stack blockchain professional. Experienced in Machine Learning and cloud technologies. Hackathon winner.,Dr. Desai
1217,Saanvi Chandra,2020,Civil Engineering,Bain & Company,Senior Strategy Consultant,Gurgaon,"GIS, STAAD Pro, Environmental Engineering, Concrete Technology",Tech lead with expertise in distributed systems. Mentoring 5+ engineers. Advocate for diversity in tech.,
1218,Abhinav Sharma,2017,Chemical Engineering,Yellow.ai,Director of Engineering,New York,"Linux, System Design, Quality Control, Six Sigma, Thermodynamics, R&D, Python",Passionate about mobile applications and System Design. Previously worked on computer vision systems at Amazon. Loves mentoring junior engineers. Transitioned from consulting to engineering management.,
1219,Om Joshi,2022,Civil Engineering,Spotify,Power Systems Engineer,Berlin,"Surveying, AutoCAD, Project Management, STAAD Pro, Water Resources",Data-driven professional focused on autonomous systems. Background in computer vision. Marathon runner and tech blogger.,
1220,Simran Bajaj,2023,Biotechnology,Netflix,Group Product Manager,Coimbatore,"Protein Engineering, Drug Discovery, Biostatistics, Biochemistry",Bridging the gap between AR/VR and deep learning. Published research in top-tier conferences.,
1221,Nandini Saxena,2019,Chemical Engineering,Meta,Principal Research Scientist,Seattle,"Thermodynamics, Python, MATLAB, Chemical Kinetics, Pharmaceutical Engineering, Process Design, Polymer Science",Career focused on distributed systems. Transitioned to Pharmaceutical Engineering after discovering passion during a side project.,
1222,Sanya Pillai,2015,Computer Science,BCG,Senior Management Consultant,Ahmedabad,"Rust, Algorithms, MongoDB",Driven by curiosity in distributed systems. Led multiple artificial intelligence projects. Believes in continuous learning and growth.,Dr. Gupta
1223,Pari Tiwari,2020,Biotechnology,Accenture,Senior Strategy Consultant,Coimbatore,"Protein Engineering, Machine Learning, Microbiology, Python, Drug Discovery, Clinical Trials, Immunology",Bridging the gap between healthtech and natural language processing. Published research in top-tier conferences.,Dr. Raghavan
1224,Deepika Chatterjee,2019,Mechanical Engineering,Byju's,VP Engineering,Bangalore,"Manufacturing, Quality Control, 3D Printing, AutoCAD, CNC Programming, Six Sigma, CFD",Specializing in distributed systems applications. Strong foundation in Manufacturing. Passionate about teaching and outreach. Transitioned from software engineering to engineering management.,
1225,Swati Iyer,2021,Chemical Engineering,IISc Research,Lab Director,Bangalore,"R&D, Six Sigma, Catalysis, Pharmaceutical Engineering, Polymer Science, Quality Control, Data Analysis",Working at the intersection of edtech and Polymer Science. Love building things that matter.,Dr. Iyer
1226,Shaurya Bose,2019,Biotechnology,Mphasis,VLSI Design Engineer,Hyderabad,"Molecular Biology, Cell Culture, Microbiology, PCR",Career focused on edge computing. Transitioned to Molecular Biology after discovering passion during a side project.,
1227,Kriti Kulkarni,2020,Biotechnology,Unacademy,Engineering Manager,Dublin,"Genomics, Cell Culture, Biostatistics, CRISPR",Building scalable edtech systems. 3+ years of experience in natural language processing. Open source contributor.,
1228,Sara Arora,2018,Chemical Engineering,CRED,Product Analyst,Chandigarh,"Pharmaceutical Engineering, R&D, ASPEN Plus, Thermodynamics, Polymer Science, Process Simulation",Entrepreneur at heart. Building products in the mobile applications space. Former software engineer at Amazon.,
1229,Mira Agarwal,2018,Civil Engineering,Zomato,Senior Embedded Systems Engineer,Chandigarh,"AutoCAD, Revit, Python, Concrete Technology, Quantity Estimation",Building scalable mobile applications systems. 2+ years of experience in Concrete Technology. Open source contributor.,Dr. Raghavan
1230,Trisha Reddy,2024,Civil Engineering,Atlan,Founder & CEO,Pune,"Geotechnical Engineering, Revit, Environmental Engineering, BIM, STAAD Pro",Focused on solving real-world problems using fintech. Background in BIM. Active tech community speaker.,
1231,Harini Tiwari,2017,Information Technology,Chargebee,Senior SDE,Pune,"AWS, Mobile Development, Redis, Cloud Computing, Cybersecurity, Microservices, Networking",Driven by curiosity in quantum computing. Led multiple natural language processing projects. Believes in continuous learning and growth.,
1232,Arnav Trivedi,2022,Computer Science,Ernst & Young,Technology Consultant,Jaipur,"Go, Linux, SQL",Tech lead with expertise in quantum computing. Mentoring 4+ engineers. Advocate for diversity in tech.,Dr. Chakraborty
1233,Pranav Srinivasan,2019,Civil Engineering,BCG,Management Consultant,Chennai,"GIS, Revit, Water Resources",Data-driven professional focused on machine learning. Background in artificial intelligence. Marathon runner and tech blogger.,Dr. Krishnamurthy
1234,Yash Srinivasan,2024,Information Technology,Ola,Principal Engineer,Kolkata,"AWS, Natural Language Processing, Tableau, Algorithms, Python",Data-driven professional focused on deep learning. Background in AR/VR. Marathon runner and tech blogger.,
1235,Vikram Srinivasan,2019,Computer Science,Unacademy,Founder & CEO,Indore,"Deep Learning, Algorithms, Redis, PyTorch, Data Structures, MongoDB, TensorFlow",healthtech enthusiast with a knack for PyTorch. Transitioned from QA engineer to pursue passion in technology.,
1236,Mira Krishnan,2020,Biotechnology,Adobe,Senior Engineering Manager,Delhi NCR,"Drug Discovery, Biochemistry, PCR, R, Machine Learning, Python",Innovation-focused engineer building next-gen frontend development solutions. Deep expertise in artificial intelligence.,
1237,Vanya Mishra,2024,Electrical Engineering,Deloitte,Business Analyst,Singapore,"Automation, Smart Grid, SCADA, Renewable Energy, Transformers, IoT, Circuit Design",Passionate about machine learning and Transformers. Previously worked on scalable microservices at Google. Loves mentoring junior engineers.,
1238,Shruti Mishra,2015,Information Technology,Spotify,Director of Product,Ahmedabad,"JavaScript, Agile, Networking",Focused on solving real-world problems using computer vision. Background in machine learning. Active tech community speaker.,Dr. Mehta
1239,Lakshmi Krishnan,2018,Electronics & Communication,Hasura,Senior Engineering Manager,Hyderabad,"MATLAB, Wireless Communication, VLSI Design, C++, Antenna Design, Robotics, Verilog",Building scalable machine learning systems. 4+ years of experience in artificial intelligence. Open source contributor.,
1240,Nandini Venkatesh,2015,Chemical Engineering,Netflix,Biotech Researcher,Dublin,"Chemical Kinetics, Process Design, Polymer Science, Pharmaceutical Engineering",Bridging the gap between edge computing and computer vision. Published research in top-tier conferences.,
1241,Aishwarya Reddy,2022,Computer Science,Netflix,Group Product Manager,Singapore,"Kafka, React, Natural Language Processing, Data Structures",fintech enthusiast with a knack for deep learning. Transitioned from mechanical engineer to pursue passion in technology.,
1242,Akash Bhatia,2016,Information Technology,BCG,Management Consultant,Chandigarh,"Networking, AWS, Cybersecurity, Data Analytics, Tableau",Passionate about cybersecurity and Cybersecurity. Previously worked on educational technology tools at a research lab. Loves mentoring junior engineers.,Dr. Patel
1243,Ramesh Desai,2020,Mechanical Engineering,Zerodha,Founder & CEO,Seattle,"Manufacturing, 3D Printing, Lean Manufacturing",Data-driven professional focused on cybersecurity. Background in Manufacturing. Marathon runner and tech blogger.,
1244,Arya Menon,2018,Electrical Engineering,Accenture,Senior Strategy Consultant,New York,"Smart Grid, Automation, IoT, Power Systems",Bridging the gap between sustainability and computer vision. Published research in top-tier conferences.,Prof. Mishra
1245,Radhika Mahajan,2015,Electronics & Communication,BCG,Senior Embedded Systems Engineer,Jaipur,"ARM Architecture, Antenna Design, FPGA, C++, Embedded Systems, IoT",Entrepreneur at heart. Building products in the quantum computing space. Former mechanical engineer at Amazon.,
1246,Ayaan Patel,2015,Electrical Engineering,KPMG,Business Analyst,Hyderabad,"IoT, Renewable Energy, Embedded Systems, Automation, SCADA",healthtech enthusiast with a knack for SCADA. Transitioned from consultant to pursue passion in technology.,
1247,Arjun Pillai,2019,Electrical Engineering,Postman,Senior SDE-III,New York,"Smart Grid, IoT, REST APIs, Electrical Machines, Embedded Systems, PyTorch, PLC Programming",Specializing in computer vision applications. Strong foundation in machine learning. Passionate about teaching and outreach.,
1248,Sakshi Subramaniam,2023,Electrical Engineering,Infosys,Senior SDE,Kolkata,"AWS, Automation, IoT, Embedded Systems, MATLAB, Power Electronics, Machine Learning",Full stack edtech professional. Experienced in Automation and cloud technologies. Hackathon winner.,
1249,Vivek Chatterjee,2019,Biotechnology,Twilio,Senior Product Analyst,Singapore,"Molecular Biology, PCR, Microbiology, Bioinformatics",Tech lead with expertise in quantum computing. Mentoring 6+ engineers. Advocate for diversity in tech.,Dr. Sharma
1250,Sanya Shah,2023,Biotechnology,Zomato,Founder,Hyderabad,"Cell Culture, PCR, Molecular Biology, Immunology, Bioinformatics, CRISPR",Tech lead with expertise in artificial intelligence. Mentoring 5+ engineers. Advocate for diversity in tech.,Dr. Venkatesh
1251,Ishaan Sethi,2020,Biotechnology,Meta,Research Scientist,New York,"Biostatistics, Machine Learning, Clinical Trials, Microbiology, Biochemistry",Full stack healthtech professional. Experienced in Biostatistics and cloud technologies. Hackathon winner.,
1252,Swati Deshpande,2023,Chemical Engineering,ShareChat,CEO,London,"Process Simulation, Quality Control, Python",Bridging the gap between cybersecurity and machine learning. Published research in top-tier conferences.,
1253,Vidya Nair,2022,Biotechnology,Wipro,Mechanical Design Engineer,Singapore,"Cell Culture, CRISPR, Microbiology, Protein Engineering, Python, Bioinformatics, PCR",Entrepreneur at heart. Building products in the sustainability space. Former consultant at Microsoft.,
1254,Devesh Arora,2016,Electronics & Communication,Twilio,Senior Backend Developer,San Francisco,"Control Systems, FPGA, IoT, Verilog, Sensor Networks, Kafka, VLSI Design",Innovation-focused engineer building next-gen data engineering solutions. Deep expertise in computer vision.,Dr. Patel
1255,Kriti Dhawan,2022,Information Technology,Flipkart,Data Scientist,Ahmedabad,"Data Analytics, Agile, Mobile Development, Natural Language Processing, Algorithms, Python, Scrum",cloud computing enthusiast with a knack for computer vision. Transitioned from project lead to pursue passion in technology. Transitioned from research to data science.,
1256,Aarav Bhatia,2023,Information Technology,OpenAI,Research Scientist,Jaipur,"JavaScript, Tableau, Networking, Node.js",Data-driven professional focused on machine learning. Background in artificial intelligence. Marathon runner and tech blogger.,
1257,Rhea Saxena,2024,Mechanical Engineering,PwC,Management Consultant,Delhi NCR,"Python, Project Management, Supply Chain, CFD, SolidWorks",Tech lead with expertise in IoT. Mentoring 2+ engineers. Advocate for diversity in tech.,Dr. Banerjee
1258,Megha Deshpande,2018,Electrical Engineering,Twilio,Director of Engineering,Delhi NCR,"Linux, Automation, Smart Grid, Embedded Systems, Go, Circuit Design, SCADA",Expert in blockchain with deep experience in natural language processing. Contributed to products used by millions of users. Transitioned from consulting to engineering management.,
1259,Krishna Rajan,2022,Biotechnology,Meesho,Structural Engineer,Chandigarh,"Molecular Biology, Bioinformatics, Python",Working at the intersection of natural language processing and artificial intelligence. Love building things that matter.,Dr. Subramaniam
1260,Om Chopra,2015,Electrical Engineering,Apple,Associate Product Manager,Delhi NCR,"Power Electronics, Power Systems, Control Systems, IoT, Renewable Energy",Expert in mobile applications with deep experience in computer vision. Contributed to products used by millions of users.,
1261,Rhea Hegde,2022,Computer Science,Twilio,Deep Learning Engineer,Chennai,"Java, Redis, Git, Microservices, CI/CD, REST APIs",Full stack cybersecurity professional. Experienced in computer vision and cloud technologies. Hackathon winner. Transitioned from research to data science.,Prof. Malhotra
1262,Vishal Kumar,2017,Information Technology,ShareChat,SDE-III,Kochi,"JavaScript, Docker, Data Analytics, Cloud Computing, Cybersecurity, SQL, Angular",Building scalable fintech systems. 4+ years of experience in Cloud Computing. Open source contributor.,
1263,Sara Desai,2016,Biotechnology,Chargebee,Co-Founder,Chandigarh,"AWS, Immunology, Biochemistry, Cell Culture, Kafka, Clinical Trials, R",Focused on solving real-world problems using natural language processing. Background in autonomous systems. Active tech community speaker. Transitioned from consulting to entrepreneurship.,
1264,Rahul Sharma,2019,Computer Science,Netflix,VP Engineering,Mumbai,"Computer Vision, Kafka, TypeScript",Career focused on cybersecurity. Transitioned to Computer Vision after discovering passion during a side project.,Dr. Mehta
1265,Simran Bhatt,2022,Electronics & Communication,Salesforce,Engineering Manager,Delhi NCR,"RF Engineering, IoT, FPGA, Verilog, GraphQL, MATLAB, React",Tech lead with expertise in cybersecurity. Mentoring 3+ engineers. Advocate for diversity in tech. Transitioned from core engineering to engineering management.,
1266,Preeti Singh,2017,Computer Science,Meta,Senior Data Scientist,Delhi NCR,"Rust, GraphQL, Go, Git, MongoDB, System Design, Node.js",Career focused on edge computing. Transitioned to computer vision after discovering passion during a side project.,
1267,Arnav Reddy,2022,Mechanical Engineering,IISc Research,Embedded Systems Engineer,Coimbatore,"Supply Chain, Quality Control, CATIA, CNC Programming, ANSYS",Data-driven professional focused on quantum computing. Background in ANSYS. Marathon runner and tech blogger.,
1268,Shreyas Kulkarni,2015,Electronics & Communication,BrowserStack,Co-Founder,Pune,"RF Engineering, Deep Learning, Verilog, MATLAB, PCB Design, CI/CD, C++",Expert in edtech with deep experience in Deep Learning. Contributed to products used by millions of users. Transitioned from data science to entrepreneurship.,
1269,Kiara Bhatia,2023,Mechanical Engineering,PwC,Senior Consultant,Tokyo,"Lean Manufacturing, CNC Programming, Robotics, Six Sigma, FEA, Thermodynamics, CATIA",Focused on solving real-world problems using autonomous systems. Background in CNC Programming. Active tech community speaker.,
1270,Lakshya Joshi,2022,Mechanical Engineering,Apple,SDE-II,Amsterdam,"SolidWorks, Supply Chain, Quality Control, TensorFlow, AutoCAD, CNC Programming, Git",Focused on solving real-world problems using sustainability. Background in SolidWorks. Active tech community speaker.,
1271,Diya Bose,2018,Electrical Engineering,Meesho,Director of Product,Toronto,"Automation, Circuit Design, Smart Grid, Renewable Energy, Control Systems",Specializing in artificial intelligence applications. Strong foundation in computer vision. Passionate about teaching and outreach.,Prof. Kapoor
1272,Aarav Arora,2023,Civil Engineering,Meta,Process Engineer,Noida,"Geotechnical Engineering, Surveying, Environmental Engineering, Project Management, Python, Water Resources",Bridging the gap between edtech and Project Management. Published research in top-tier conferences.,Dr. Krishnamurthy
1273,Rajesh Chatterjee,2017,Information Technology,Google,Engineering Manager,Ahmedabad,"Power BI, NoSQL, Node.js, React, Data Analytics, Tableau",Data-driven professional focused on edge computing. Background in computer vision. Marathon runner and tech blogger.,
1274,Neeraj Banerjee,2020,Electrical Engineering,Google,Senior SDE-II,San Francisco,"Renewable Energy, Power Systems, Smart Grid, Electrical Machines, Natural Language Processing, Circuit Design, SCADA",Career focused on frontend development. Transitioned to Power Systems after discovering passion during a side project.,
1275,Tushar Bhatt,2019,Biotechnology,CRED,Group Product Manager,Kochi,"AWS, Bioinformatics, Biochemistry, Machine Learning, Algorithms",Full stack artificial intelligence professional. Experienced in deep learning and cloud technologies. Hackathon winner. Transitioned from data science to product management.,
